{
  "policy_id": "urn:foi-process:publication:dashboard-default",
  "events": [
    {
      "event_id": "urn:foi-process:event:sha256:488318155be303cd1835042fc3a76276014006f5d77eae0509c6121eff97f019",
      "logical_event_id": "urn:foi-process:event-logical:sha256:ffd897c79930eb5a88dc00c48294e4a72ba7497b2e9353da555d1d672a26fcc7",
      "site": "urn:alaveteli:site:fyi.org.nz",
      "jurisdiction": "jurisdiction:NZ",
      "case_id": "urn:fyi-nz:request:demo-1",
      "activity": "foio:RequestSent",
      "event_time": {
        "timestamp": "2025-01-06T09:00:00+13:00",
        "precision": "second"
      },
      "assertion_status": "observed",
      "source_sequence": 1,
      "evidence": [
        {
          "evidence_id": "urn:foi-process:evidence:sha256:a33d1928732a74c3599dbe63ead7177d6bd97d0c3f0f5a955da5b075ec054690",
          "uri": "https://fyi.org.nz/request/demo/1",
          "media_type": "application/json",
          "content_sha256": "b47b0689920bfb13bd9dfc74eea1dbd8cddc3461e43e17100ecb10285e145713"
        }
      ],
      "attributes": {
        "native_activity": "request_sent",
        "authority_id": "nz:agency:demo"
      }
    },
    {
      "event_id": "urn:foi-process:event:sha256:a69853571fb4dc70389c98082684cfdef20bc844e617ab5109f7556931cb0824",
      "logical_event_id": "urn:foi-process:event-logical:sha256:c9fe270cf05f66c4fcbd0b02f9387dff3879cbac23e7272b90b7aad1ac084d17",
      "site": "urn:alaveteli:site:fyi.org.nz",
      "jurisdiction": "jurisdiction:NZ",
      "case_id": "urn:fyi-nz:request:demo-1",
      "activity": "foio:AuthorityResponseReceived",
      "event_time": {
        "timestamp": "2025-01-07T11:00:00+13:00",
        "precision": "second"
      },
      "assertion_status": "observed",
      "source_sequence": 2,
      "evidence": [
        {
          "evidence_id": "urn:foi-process:evidence:sha256:4eb715686da5d7e69f69d2b46d2a8a5bfb5eda59de3827c95d17c68063452c56",
          "uri": "https://fyi.org.nz/request/demo/2",
          "media_type": "application/json",
          "content_sha256": "3ef25c849197ef76226ed8bb9b8aa4dc0212702980f2eb38b1ab98ee0c9a9647"
        }
      ],
      "attributes": {
        "native_activity": "authority_response",
        "authority_id": "nz:agency:demo"
      }
    },
    {
      "event_id": "urn:foi-process:event:sha256:133b6c39a818dbba4237ed8f9c92753eb6594643eaf0f1465d9a8b91fea95816",
      "logical_event_id": "urn:foi-process:event-logical:sha256:5c4e4ab2696153f207922c737f3cba63feac3c67a79be32f308930c1d23977a0",
      "site": "urn:alaveteli:site:fyi.org.nz",
      "jurisdiction": "jurisdiction:NZ",
      "case_id": "urn:fyi-nz:request:demo-1",
      "activity": "foio:ExtensionNotified",
      "event_time": {
        "timestamp": "2025-01-20T10:15:00+13:00",
        "precision": "second"
      },
      "assertion_status": "observed",
      "source_sequence": 4,
      "evidence": [
        {
          "evidence_id": "urn:foi-process:evidence:sha256:916da5d65c80f9b71594a441cc7985fb547c7f27f03d727fc6cade23d8fff636",
          "uri": "https://fyi.org.nz/request/demo/3",
          "media_type": "application/json",
          "content_sha256": "1bc5ba35cb9794ff3a9a5fbc49425f0c42c4f24594a4b999955984261bc5e566"
        }
      ],
      "attributes": {
        "native_activity": "extension",
        "authority_id": "nz:agency:demo"
      }
    },
    {
      "event_id": "urn:foi-process:event:sha256:e66d4ac737f648d564f71e2357a2fa1b5dbc0e1f9d20331ef197e7907f353e07",
      "logical_event_id": "urn:foi-process:event-logical:sha256:3442aa10af59ff9e9643a983d68578437f5308c5dca3c374525e0f78ac5aa4a7",
      "site": "urn:alaveteli:site:fyi.org.nz",
      "jurisdiction": "jurisdiction:NZ",
      "case_id": "urn:fyi-nz:request:demo-1",
      "activity": "foio:ClosedObserved",
      "event_time": {
        "timestamp": "2025-02-14T16:00:00+13:00",
        "precision": "second"
      },
      "assertion_status": "observed",
      "source_sequence": 5,
      "evidence": [],
      "attributes": {
        "native_activity": "closed",
        "authority_id": "nz:agency:demo"
      }
    }
  ],
  "withheld_event_count": 0,
  "metadata_only_event_count": 1
}
